Sheet: Sheet1
B1: Axial rotation days | C1: Diameter | D1: Distance (x1000) | E1: Rotation around sun days | F1: Tilt | G1: Distance | H1: Eccentricity | I1: AU
A2: Sun | B2: 0 | C2: 1391900 | D2: = RC[3]/1000 -> 0 | E2: 0 | F2: 0 | G2: 0 | H2: 0.20599999999999999
A3: Mercury | B3: = 58 + 15.5/24 -> 58.645833333333336 | C3: 4866 | D3: = RC[3]/1000 -> 57000 | E3: 88 | F3: 0 | G3: 57000000 | H3: 6.7999999999999996E-3 | I3: 0.3871
A4: Venus | B4: = 243 + 26 / (24*60) -> 243.01805555555555 | C4: 12106 | D4: = RC[3]/1000 -> 108000 | E4: 225 | F4: 177.3 | G4: 108000000 | H4: 1.67E-2 | I4: 0.7233
A5: Earth | B5: = (23*60 + 56) / (24*60) -> 0.99722222222222223 | C5: 12742 | D5: = RC[3]/1000 -> 150000 | E5: 365.25 | F5: 23.4 | G5: 150000000 | H5: 9.3399999999999997E-2 | I5: 1000
A6: Mars | B6: = 1 + (36) / (24*60) -> 1.0249999999999999 | C6: 6760 | D6: = RC[3]/1000 -> 228000 | E6: = 1.88 * R[-1]C -> 686.67 | F6: 25.2 | G6: 228000000 | H6: 4.8500000000000001E-2 | I6: 15273
A7: Jupiter | B7: = (9*60 + 55) / (24*60) -> 0.41319444444444442 | C7: 139516 | D7: = RC[3]/1000 -> 779000 | E7: = 11.86 * R[-2]C -> 4331.8649999999998 | F7: 3.1 | G7: 779000000 | H7: 5.5599999999999997E-2 | I7: 52028
A8: Saturn | B8: = (10 *60 +40) / (24*60) -> 0.44444444444444442 | C8: 116438 | D8: = RC[3]/1000 -> 1430000 | E8: = 29.45 * R[-3]C -> 10756.612499999999 | F8: 26.7 | G8: 1430000000 | H8: 4.7199999999999999E-2 | I8: 95388
A9: Uranus | B9: = (17 *60 +14)/(24*60) -> 0.71805555555555556 | C9: 46940 | D9: = RC[3]/1000 -> 2880000 | E9: = 84* R[-4]C -> 30681 | F9: 97.8 | G9: 2880000000 | H9: 8.6E-3 | I9: 191914
A10: Neptune | B10: = 16/24 -> 0.66666666666666663 | C10: 45432 | D10: = RC[3]/1000 -> 4500000 | E10: = 164.81 *R[-5]C -> 60196.852500000001 | F10: 28.3 | G10: 4500000000 | H10: 0.25 | I10: 300611

Sheet: Sheet2
A1: Planet | B1: Diameter | C1: Tilt | D1: Axial rotation | E1: Rotation around sun | F1: AU | G1: Eccentricity
A2: Mercury | B2: 4866 | C2: 0 | D2: = 58 + 15.5/24 -> 58.645833333333336 | E2: 88 | F2: 0.3871 | G2: 6.7999999999999996E-3
A3: Venus | B3: 12106 | C3: 177.3 | D3: = 243 + 26 / (24*60) -> 243.01805555555555 | E3: 225 | F3: 0.7233 | G3: 1.67E-2
A4: Earth | B4: 12742 | C4: 23.4 | D4: = (23*60 + 56) / (24*60) -> 0.99722222222222223 | E4: 365.25 | F4: 1000 | G4: 9.3399999999999997E-2
A5: Mars | B5: 6760 | C5: 25.2 | D5: = 1 + (36) / (24*60) -> 1.0249999999999999 | E5: = 1.88 * R[-1]C -> 686.67 | F5: 15273 | G5: 4.8500000000000001E-2
A6: Jupiter | B6: 139516 | C6: 3.1 | D6: = (9*60 + 55) / (24*60) -> 0.41319444444444442 | E6: = 11.86 * R[-2]C -> 4331.8649999999998 | F6: 52028 | G6: 5.5599999999999997E-2
A7: Saturn | B7: 116438 | C7: 26.7 | D7: = (10 *60 +40) / (24*60) -> 0.44444444444444442 | E7: = 29.45 * R[-3]C -> 10756.612499999999 | F7: 95388 | G7: 4.7199999999999999E-2
A8: Uranus | B8: 46940 | C8: 97.8 | D8: = (17 *60 +14)/(24*60) -> 0.71805555555555556 | E8: = 84* R[-4]C -> 30681 | F8: 191914 | G8: 8.6E-3
A9: Neptune | B9: 45432 | C9: 28.3 | D9: = 16/24 -> 0.66666666666666663 | E9: = 164.81 *R[-5]C -> 60196.852500000001 | F9: 300611 | G9: 0.25